source,reqs
2005_claruslow_PURE,QEDS shall accept location queries based on a latitude/longitude location and radius.
2005_claruslow_PURE,The Clarus system shall enable environmental data queries by quality.
2005_claruslow_PURE,QEDS shall accept quality flag queries based on a range of quality flag values.
2005_claruslow_PURE,The Clarus system shall enable environmental data queries by source.
2005_claruslow_PURE,QEDS shall accept source queries that consist of a list of Clarus contributors.
2005_claruslow_PURE,QEDS shall accept source queries that are a list of Clarus contributors combined with a station identifier.
2005_claruslow_PURE,The Clarus system shall allow users to create a data subscription request.
2005_claruslow_PURE,QEDS shall be able to accept a subscription request.
2005_claruslow_PURE,QEDS shall accept data subscriptions that include an environmental data request and the publishing trigger.
2005_claruslow_PURE,QEDS shall be able to accept subscription requests with triggers based on a schedule.
2005_claruslow_PURE,QEDS shall be able to accept subscription requests with triggers based on quality flag state changes.
2005_claruslow_PURE,QEDS shall disseminate subscription responses to the originating request address by default.
2005_claruslow_PURE,QEDS shall disseminate subscription responses to a specified return address.
2005_claruslow_PURE,QEDS shall uniquely identify environmental data subscriptions.
2005_claruslow_PURE,QEDS shall automatically delete a subscription when the triggering event will not occur again and no more responses are possible.
2005_claruslow_PURE,The Clarus system shall be able to publish new data within twenty minutes of data receipt.
2005_claruslow_PURE,QEDS shall disseminate subscription responses within twenty minutes of new data becoming available.
2005_claruslow_PURE,The Clarus system shall respond to a request for information within one minute.
2005_claruslow_PURE,QEDS shall respond to an environmental data request within one minute.
2005_claruslow_PURE,The Clarus system shall be able to handle three hundred simultaneous requests for environmental data.
2005_claruslow_PURE,QEDS shall be able to respond to three hundred simultaneous queries.
2005_claruslow_PURE,"The Clarus system shall collect, quality check, and disseminate environmental data."
2005_claruslow_PURE,The QChS shall quality check environmental data.
2005_claruslow_PURE,The Clarus system shall implement quality checking processes as soon as data become available.
2005_claruslow_PURE,QChS shall be able to be configured individually.
2005_claruslow_PURE,QChS processing order shall be able to be configured.
2005_claruslow_PURE,QChS processing shall commence when new data arrives but no less frequently than the scheduled interval.
2005_claruslow_PURE,The Clarus system shall provide environmental data quality flags.
2005_claruslow_PURE,Each QChS shall produce a unique quality flag value.
2005_claruslow_PURE,The QChS shall be able to indicate a numeric confidence value.
2005_claruslow_PURE,The Clarus system shall provide notification of data quality conditions to data contributors.
2005_claruslow_PURE,A QChS shall evaluate data quality conditions.
2005_claruslow_PURE,The Clarus system shall detect out of range values.
2005_claruslow_PURE,QChS algorithms shall use sensor range metadata for range checking bounds.
2005_claruslow_PURE,QChS algorithms shall use climate records for range checking bounds.
2005_claruslow_PURE,QChS algorithms shall be able to use monthly climate extremes for range checking bounds.
2005_claruslow_PURE,The Clarus system shall not modify original observations.
2005_claruslow_PURE,"QChS shall apply separate, independent quality flags that do not modify the observation."
2005_claruslow_PURE,The Clarus system shall allow human quality checks of observations.
2005_claruslow_PURE,QChS shall implement a manual override to set quality flags.
2005_claruslow_PURE,The Clarus system shall record the methods applied when deriving quality checking information.
2005_claruslow_PURE,QChS shall indicate when a quality check has been performed.
2005_claruslow_PURE,The Clarus system shall be able to implement quality checking rules for each environmental parameter.
2005_claruslow_PURE,QChS shall be able to implement quality checking rules for a specific environmental parameter.
2005_claruslow_PURE,The Clarus system shall be able to implement quality checking rules for specific environmental situations.
2005_claruslow_PURE,QChS shall be able to implement quality checking rules for specific environmental situations.
2005_claruslow_PURE,The Clarus system shall be able to implement quality checking spatial tests using available data.
2005_claruslow_PURE,QChS shall be able to implement quality checking spatial tests using available data.
2005_claruslow_PURE,The Clarus system shall be able to implement quality checking rules specific to observation locations.
2005_claruslow_PURE,QChS shall be able to implement different quality checking rules specific to regional weather.
2005_claruslow_PURE,The Clarus system shall be able to base its quality checking process on values from multiple observations.
2005_claruslow_PURE,QChS shall be able to flag observations based on more than one observation type.
2005_claruslow_PURE,The Clarus system shall be able to base its quality checking process on values distributed in time.
2005_claruslow_PURE,QChS shall be able to base its quality checking process on values distributed in time.
2005_claruslow_PURE,The Clarus system shall be able to base its quality checking process on historical environmental data.
2005_claruslow_PURE,QChS shall be able to use historical environmental data in their quality checking algorithms.
2005_claruslow_PURE,The Clarus system shall be able to use multiple algorithms for its quality checking process.
2005_claruslow_PURE,QChS shall be implemented for each defined standard quality checking algorithm.
2005_claruslow_PURE,The Clarus system shall allow access to new surface transportation related observed environmental data.
2005_claruslow_PURE,QChS shall be implemented to quality check new observation types as they become available.
2005_claruslow_PURE,The Clarus system shall process data as they are received.
2005_claruslow_PURE,QChS shall apply quality flags to data as they are received.
2005_claruslow_PURE,The Clarus system shall log data transactions.
2005_claruslow_PURE,QChS shall log quality checking activity.
2005_claruslow_PURE,"The Clarus system shall acquire, process, and disseminate environmental data."
2005_claruslow_PURE,"The Clarus system shall be able to acquire, process, and disseminate environmental data from across North America."
2005_claruslow_PURE,QChS shall process environmental data from across North America.
2005_claruslow_PURE,The Clarus system shall be able to complete an automated quality checking check of environmental data within ten seconds of data receipt.
2005_claruslow_PURE,A QChS shall be able to complete an automated quality check within ten seconds of when data is available for checking.
2005_claruslow_PURE,The Clarus system shall be able to publish new data within twenty minutes of data receipt.
2005_claruslow_PURE,All QChS shall be completed within twenty minutes of data being available for checking.
2005_claruslow_PURE,The Clarus system shall disseminate data in response to a scheduled request.
2005_claruslow_PURE,The SS shall be able to initiate a QEDS response.
2005_claruslow_PURE,The Clarus system shall implement quality checking processes as soon as data become available.
2005_claruslow_PURE,The SS shall be able to initiate QChS.
2005_claruslow_PURE,The Clarus system shall log data transactions.
2005_claruslow_PURE,The SS shall record when it initiates actions.
2005_claruslow_PURE,The Clarus system shall transfer data as efficiently as possible.
2005_claruslow_PURE,The SS shall be able to store event schedules.
2005_claruslow_PURE,The SS shall be able to initiate CS.
2005_claruslow_PURE,The Clarus system shall be able to be hosted at one or more physical locations.
2005_claruslow_PURE,The Clarus system shall track its constituent hosts.
2005_claruslow_PURE,The Clarus system shall allocate each collector to a specific host.
2005_claruslow_PURE,The Clarus system shall allocate each contributor to a specific host.
2005_claruslow_PURE,Clarus hosts shall be able to aggregate environmental data from other Clarus hosts.
2005_claruslow_PURE,Clarus hosts shall be able to distribute queries to other Clarus hosts.
2005_claruslow_PURE,The Clarus system shall use hardware that implements industry accepted standard interfaces.
2005_claruslow_PURE,The Clarus system shall use software that implements industry accepted standard interfaces.
2005_claruslow_PURE,The Clarus system shall be able to operate on redundant hardware.
2005_claruslow_PURE,All HTML coding shall meet FHWA requirements for web sites.
2005_claruslow_PURE,The Clarus system shall support modular components.
2005_claruslow_PURE,"The Clarus system shall be able to use latitude, longitude, and elevation coordinates to specify location to the nearest three feet."
2005_claruslow_PURE,The Clarus system shall use Coordinated Universal Time (UTC) for all timestamps.
2005_claruslow_PURE,The Clarus program shall alert users to system modifications.
2005_claruslow_PURE,The Clarus system shall be able to publish environmental data at three times the volume rate that it collects it.
2005_claruslow_PURE,The Clarus system shall be able to support six hundred concurrent users.
2005_claruslow_PURE,The Clarus system shall be able to support six thousand registered users.
2005_claruslow_PURE,The Clarus system shall be able to mitigate communication denial-of- service attacks.
2005_claruslow_PURE,The Clarus system shall be able to respond to 95% of all requests for environmental data 95% of the time.
2005_claruslow_PURE,The Clarus program shall establish data sharing agreements with all participating sources of environmental data.
2005_claruslow_PURE,The Clarus program shall identify categories of recipients for dissemination of data.
2005_claruslow_PURE,"The Clarus program shall determine the need for bilateral Clarus Data Sharing Agreements with countries, agencies, states, and regions."
2005_claruslow_PURE,The authorized representative(s) of the contributors shall be identified.
2005_claruslow_PURE,The contributors shall identify and define the types of data and information that will be included in the Clarus Data Sharing Agreement.
2005_claruslow_PURE,The contributors shall identify the intended use of their shared data and information.
2005_claruslow_PURE,The contributors shall identify the categories of recipients of their shared data and information.
2005_claruslow_PURE,The contributors shall define the units of measurements of their shared data and information.
2005_claruslow_PURE,The Clarus program shall determine how it will provide data and information to contributors.
2005_claruslow_PURE,The Clarus program shall provide data and information statistics on its operation to contributors.
2005_claruslow_PURE,The contributors shall inform the Clarus program of changes in authorized personnel/offices.
2005_claruslow_PURE,"The Clarus program shall inform contributors of the ""acceptance and use"" of their data and information."
2005_claruslow_PURE,The Clarus Initiative Management Team shall undertake joint communications activities and products that will enhance public understanding and dissemination of contributions of the Clarus program.
2005_claruslow_PURE,The Clarus Initiative Management Team shall agree upon the activities and products that will enhance public understanding/ communication of the contribution of the Clarus program.
2005_claruslow_PURE,The contributors shall inform the Clarus program of known error(s) and modifications in its data and information.
2005_claruslow_PURE,The Clarus program shall determine its redistribution of shared data from contributors based upon Clarus Data Sharing Agreements.
2005_claruslow_PURE,The Clarus program shall report successes and failures in data and information transmission to its contributors.
2005_claruslow_PURE,The contributors shall report periods of data and information outages to the Clarus program.
2005_claruslow_PURE,The Clarus program shall maintain information about requestors and their access to data and information.
2005_claruslow_PURE,The Clarus Initiative Management Team shall review and amend data and information sharing and use policies.
2005_claruslow_PURE,The Clarus Initiative Management Team shall specify the general frequency of policy meetings.
2005_claruslow_PURE,The Clarus Initiative Coordinating Committee shall nominate technical expert(s) to participate on technical working groups.
2005_claruslow_PURE,The requestors shall adhere to the intellectual property requirements of the Clarus User Agreement.
2005_claruslow_PURE,The contributors shall adhere to the intellectual property requirements of the Clarus Data Sharing Agreement.
2005_claruslow_PURE,The contributors shall have the right to use the Clarus system data and information for purposes delineated within the Clarus Data Sharing Agreement.
2005_claruslow_PURE,The requestors shall have the right to use the Clarus system data and information for purposes delineated within the Clarus User Agreement.
2005_claruslow_PURE,The Clarus program shall have the right to reject the use of data and information provided by the contributors when deemed appropriate.
2005_claruslow_PURE,"The Clarus program shall inform contributors of the policies, processes and procedures employed to reject data and information provided by the contributors."
2005_claruslow_PURE,"The contributors shall provide the Clarus program with a timely notice of their intent to change, alter, replace, or eliminate any shared data and information as specified within this Clarus Data Sharing Agreement."
2005_claruslow_PURE,"Any reference in the Clarus Data Sharing Agreement to statutes, regulations and rules shall be a reference to the amended, substituted, replaced or re-enacted statute, regulations and rules."
2005_claruslow_PURE,The Clarus program shall provide to contributors the limitation of liability for contributing environmental data and metadata.
2005_claruslow_PURE,The Clarus program shall provide to requesters the limitation of liability for using environmental data and metadata.
2005_claruslow_PURE,The Clarus program shall maintain continuous 24x7 operations.
2005_claruslow_PURE,The Clarus program shall provide an environment that has uninterruptible power for the Clarus system.
2005_claruslow_PURE,The Clarus program shall provide an environment that has redundant communication for the Clarus system.
2005_claruslow_PURE,The Clarus program shall provide network management tools.
2005_claruslow_PURE,The Clarus program shall provide setup support.
2005_claruslow_PURE,The Clarus program shall provide for customer service.
2005_claruslow_PURE,The Clarus program shall provide a trained support staff.
2005_claruslow_PURE,The Clarus program shall define quality checking rules for environmental observations.
2005_claruslow_PURE,The Clarus program shall define data retention standards.
2005_claruslow_PURE,The Clarus program shall provide documentation of Clarus standards.
2005_claruslow_PURE,The Clarus program standards shall accommodate contributions of new sensor technologies to the Clarus system.
2005_claruslow_PURE,The Clarus program standards shall support multiple methods of data delivery to users.
2005_claruslow_PURE,The Clarus program shall maintain a comprehensive Clarus system test environment.
2005_claruslow_PURE,The Clarus program shall test all software changes in the designated test environment before deployment to production.
2005_claruslow_PURE,The Clarus program shall test all hardware changes in the designated test environment before deployment to production.
2005_claruslow_PURE,The Clarus program shall operate the Clarus system according to its published IT Security Plan.
2005_claruslow_PURE,"The Clarus program shall operate according to Government IT security requirements as outlined in OMB Circular A-130, Management of Federal Information Resources, Appendix III, Security of Federal Automated Information Resources."
2005_claruslow_PURE,"The Clarus program shall operate according to Government IT security requirements as outlined in the National Institute of Standards and Technology (NIST) Guidelines, Departmental Information Resource Management Manual, and associated guidelines."
2005_claruslow_PURE,"The Clarus program shall operate according to Government IT security requirements as outlined in U.S. DOT Order 1630.2B, Personnel Security Management."
2005_claruslow_PURE,Weather service providers shall be able to use Clarus data to provide localized special weather products.
2005_claruslow_PURE,Public agency maintenance and construction personnel shall be able to use the Clarus system to obtain environmental conditions.
2005_claruslow_PURE,Rail system personnel shall be able to use the Clarus system to obtain environmental conditions.
2005_claruslow_PURE,Traffic management personnel shall be able to use the Clarus system to obtain environmental conditions.
2005_claruslow_PURE,Transit personnel shall be able to use the Clarus system to obtain environmental conditions.
2005_claruslow_PURE,The freight community shall be able to use the Clarus system to obtain environmental conditions.
2005_claruslow_PURE,Emergency management and public safety personnel shall be able to use the Clarus system to obtain environmental conditions.
2005_claruslow_PURE,The Clarus program shall maintain information about data providers.
2005_claruslow_PURE,The Clarus program shall maintain metadata about each data provider's network.
2005_claruslow_PURE,The Clarus program shall maintain information about data provider redistribution restrictions.
2005_claruslow_PURE,The Clarus program shall maintain information about service providers.
2005_claruslow_PURE,The Clarus program shall maintain information about service provider communications.
2005_claruslow_PURE,The Clarus program shall maintain information about service provider access to data.
2005_claruslow_PURE,The Clarus program shall allow potential weather element data providers to request permission to submit weather information.
2005_claruslow_PURE,The Clarus system shall accept data only from sources which data sharing agreements have been established.
