source,reqs
2005_claruslow_PURE,The Clarus system shall implement quality checking processes as soon as data become available.
2005_claruslow_PURE,The CAS shall be able to configure schedules for executing QChS.
2005_claruslow_PURE,The Clarus system shall record the methods applied when deriving quality checking information.
2005_claruslow_PURE,The CAS shall record the quality checking methods used.
2005_claruslow_PURE,The Clarus system shall be able to implement quality checking rules for each environmental parameter.
2005_claruslow_PURE,The CAS shall be able to configure the quality checking rules for each environmental parameter.
2005_claruslow_PURE,The CAS shall enable administrators to manage quality checking rules.
2005_claruslow_PURE,The Clarus system shall be able to implement quality checking rules for specific environmental situations.
2005_claruslow_PURE,The CAS shall be able to configure quality checking rules for specific environmental situations.
2005_claruslow_PURE,The Clarus system shall be able to implement quality checking rules specific to observation locations.
2005_claruslow_PURE,The CAS shall be able to configure quality checking rules specific to observation locations.
2005_claruslow_PURE,The Clarus system shall be able to base its quality checking process on historical environmental data.
2005_claruslow_PURE,The CAS shall be able to configure historical environmental data to be used by quality checking processes.
2005_claruslow_PURE,The Clarus system shall be able to use multiple algorithms for its quality checking process.
2005_claruslow_PURE,The CAS shall be able to configure multiple algorithms to be used in the quality checking process.
2005_claruslow_PURE,The Clarus system shall allow access to new surface transportation-related environmental data.
2005_claruslow_PURE,The CAS shall be configurable to allow new observation types to be implemented as they become available.
2005_claruslow_PURE,The Clarus system shall enable administrators to manage security groups.
2005_claruslow_PURE,The CAS system shall enable administrators to manage security group members.
2005_claruslow_PURE,The CAS shall have an administrator security group.
2005_claruslow_PURE,The CAS shall have a quality manager security group.
2005_claruslow_PURE,The Clarus system shall be able to restrict environmental data publication based on source.
2005_claruslow_PURE,The CAS shall be able to record data sharing restrictions.
2005_claruslow_PURE,The Clarus system shall record statistics about its operation.
2005_claruslow_PURE,The CAS shall record statistics about the system operation.
2005_claruslow_PURE,The Clarus system shall log data transactions.
2005_claruslow_PURE,The CAS shall log data transactions.
2005_claruslow_PURE,"The Clarus system shall acquire, process, and disseminate environmental metadata."
2005_claruslow_PURE,The CAS shall manage contributor metadata.
2005_claruslow_PURE,The CAS shall manage collector metadata.
2005_claruslow_PURE,The CAS shall manage quality checking schedules.
2005_claruslow_PURE,The CAS shall manage environmental data collection schedules.
2005_claruslow_PURE,The CAS shall manage ESS metadata.
2005_claruslow_PURE,The Clarus system shall manage environmental data and metadata according to the Clarus data sharing agreements.
2005_claruslow_PURE,The CAS shall manage data sharing rules based on contributor data sharing agreements.
2005_claruslow_PURE,"The Clarus system shall collect, quality check, and disseminate environmental data."
2005_claruslow_PURE,The CAUI shall be able to initiate CS on demand.
2005_claruslow_PURE,The Clarus system shall provide environmental data quality flags.
2005_claruslow_PURE,The CAUI shall enable a quality manager to apply manual flags to a set of observations from an individual ESS.
2005_claruslow_PURE,The CAUI shall enable a quality manager to apply manual flags to a set of observations.
2005_claruslow_PURE,The CAUI shall enable a quality manager to apply manual flags to a set of observations over a fixed time range.
2005_claruslow_PURE,The CAUI shall enable a quality manager to apply manual flags to a set of observations over a time range with an open ended future time.
2005_claruslow_PURE,The Clarus system shall allow human quality checks of environmental data.
2005_claruslow_PURE,The CAUI shall allow a quality manager to apply a manual quality flag to environmental data.
2005_claruslow_PURE,The CAUI shall allow manual quality flags to be entered.
2005_claruslow_PURE,The Clarus system shall be able to implement quality checking rules specific to each environmental parameter.
2005_claruslow_PURE,The CAUI shall enable quality checking rules to be configured specific to each environmental parameter.
2005_claruslow_PURE,The Clarus system shall enable administrators to manage security groups.
2005_claruslow_PURE,The CAUI shall enable administrators to manage security group members.
2005_claruslow_PURE,"The Clarus system shall acquire, process, and disseminate environmental metadata."
2005_claruslow_PURE,The CAUI shall enable administrators to acquire environmental metadata.
2005_claruslow_PURE,The CAUI shall enable administrators to manage environmental metadata.
2005_claruslow_PURE,The Clarus system shall provide a user interface for administration.
2005_claruslow_PURE,The CAUI shall enable administrators to manage contributor metadata.
2005_claruslow_PURE,The CAUI shall enable administrators to manage collector metadata.
2005_claruslow_PURE,The CAUI shall enable administrators to manage quality checking schedules.
2005_claruslow_PURE,The CAUI shall enable administrators to manage environmental data collection schedules.
2005_claruslow_PURE,The Clarus system shall manage environmental data and metadata according to the Clarus data sharing agreements.
2005_claruslow_PURE,The CAUI shall enable administrators to manage contributor data sharing agreements.
2005_claruslow_PURE,The CAUI shall enable administrators to assign system privileges.
2005_claruslow_PURE,"The Clarus system shall collect, quality check, and disseminate environmental data."
2005_claruslow_PURE,CS shall collect environmental data based on its configured schedule.
2005_claruslow_PURE,CS shall be able to transform extracted environmental data into the internal storage format.
2005_claruslow_PURE,CS shall be able to store transformed environmental data in the QEDC.
2005_claruslow_PURE,CS shall be able to convert observation units into the Clarus standard unit specification.
2005_claruslow_PURE,CS shall be able to be initiated on a schedule.
2005_claruslow_PURE,CS shall be able to be initiated on demand.
2005_claruslow_PURE,The Clarus system shall be able to detect data submission errors.
2005_claruslow_PURE,CS shall log when a data submission error occurs.
2005_claruslow_PURE,The Clarus system shall be able to access in-situ environmental observations from data collectors.
2005_claruslow_PURE,CS shall be able to collect in-situ environmental observations from data collectors.
2005_claruslow_PURE,The Clarus system shall be able to access remotely sensed environmental observations from data collectors.
2005_claruslow_PURE,CS shall be able to retrieve remotely sensed environmental observations from data collectors.
2005_claruslow_PURE,The Clarus system shall be able to receive roadway weather measurements derived from VII data.
2005_claruslow_PURE,CS shall be able to retrieve roadway weather measurements derived from VII data.
2005_claruslow_PURE,The Clarus system shall allow access to new surface transportation-related observed environmental data.
2005_claruslow_PURE,CS shall be able to be implemented to collect new observation types as they become available.
2005_claruslow_PURE,The Clarus system shall accept environmental data derived from images.
2005_claruslow_PURE,CS shall accept surface condition data derived from surface images.
2005_claruslow_PURE,CS shall accept atmospheric condition data derived from atmospheric images.
2005_claruslow_PURE,The Clarus system shall be able to retrieve environmental data directly from environmental sensor station collectors.
2005_claruslow_PURE,CS shall be able to retrieve environmental data directly from environmental sensor station collectors.
2005_claruslow_PURE,The Clarus system shall minimize the time for data acquisition.
2005_claruslow_PURE,CS shall be able to dynamically adjust its retrieval schedules when environmental data is expected to be ready but is temporarily delayed.
2005_claruslow_PURE,The Clarus system shall process data as they are received.
2005_claruslow_PURE,CS shall process environmental data as they are received.
2005_claruslow_PURE,The Clarus system shall collect pavement-related observations.
2005_claruslow_PURE,CS shall be able to collect pavement-related observations.
2005_claruslow_PURE,The Clarus system shall accept environmental data from railway systems or in-situ ESS along tracks.
2005_claruslow_PURE,CS shall be able to collect environmental data from railway systems from railway collectors.
2005_claruslow_PURE,CS shall be able to collect environmental data from in-situ ESS along tracks from railway collectors.
2005_claruslow_PURE,The Clarus system shall accept environmental data from railroad vehicles.
2005_claruslow_PURE,CS shall accept environmental data derived from railroad vehicle data.
2005_claruslow_PURE,The Clarus system shall accept environmental data from (roadway) vehicles.
2005_claruslow_PURE,CS shall accept environmental data collected from (roadway) vehicles.
2005_claruslow_PURE,The Clarus system shall accept environmental data from maintenance and construction vehicles.
2005_claruslow_PURE,CS shall accept environmental data collected from maintenance and construction vehicles.
2005_claruslow_PURE,The Clarus system shall accept environmental data from service patrol vehicles.
2005_claruslow_PURE,CS shall accept environmental data collected from service patrol vehicles.
2005_claruslow_PURE,The Clarus system shall accept environmental data from transit vehicles.
2005_claruslow_PURE,CS shall accept environmental data collected from transit vehicles.
2005_claruslow_PURE,The Clarus system shall accept environmental data from emergency vehicles.
2005_claruslow_PURE,CS shall accept environmental data collected from emergency vehicles.
2005_claruslow_PURE,The Clarus system shall be able to receive weather data from weather service providers.
2005_claruslow_PURE,CS shall be able to receive weather data from weather service providers.
2005_claruslow_PURE,The Clarus system shall log data transactions.
2005_claruslow_PURE,CS shall create a log entry when a data set is invalid.
2005_claruslow_PURE,The Clarus system baseline data types shall be defined by the NTCIP ESS 1204 standard.
2005_claruslow_PURE,CS shall accept data types defined by NTCIP 1204.
2005_claruslow_PURE,"The Clarus system data definitions shall be consistent with the ITE TM 1.03 standard, Functional Level Traffic Management Data Dictionary (TMDD)."
2005_claruslow_PURE,CS shall accept environmental data described by definitions defined by the TMDD.
2005_claruslow_PURE,CS shall accept environmental data described by definitions defined by CMML version 2.
2005_claruslow_PURE,"The Clarus system shall acquire, process, and disseminate environmental data."
2005_claruslow_PURE,"The Clarus system shall accept only observations that include location, timestamp, and source metadata."
2005_claruslow_PURE,"CS shall accept only observations that include location, timestamp, and source metadata."
2005_claruslow_PURE,The Clarus system shall accept only observations of identified measurement types and units.
2005_claruslow_PURE,CS shall accept only observation of identified measurement types and units.
2005_claruslow_PURE,"The Clarus system shall be able to acquire, process, and disseminate environmental data from across North America."
2005_claruslow_PURE,CS shall be able to acquire environmental data from across North America.
2005_claruslow_PURE,The Clarus system shall accept data through a Clarus standard interface.
2005_claruslow_PURE,CS shall implement the Clarus standard interface.
2005_claruslow_PURE,The Clarus system shall be able to communicate with environmental sensor stations through its collector using the NTCIP ESS 1204.
2005_claruslow_PURE,CS shall be able to process NTCIP ESS 1204 data.
2005_claruslow_PURE,The Clarus system shall be able to communicate with RWIS databases through their native interfaces.
2005_claruslow_PURE,CS shall be able to accept data from an RWIS database in its native output format.
2005_claruslow_PURE,The Clarus system shall be able to communicate with an individual ESS through its native interface.
2005_claruslow_PURE,The Clarus system shall transfer data as efficiently as possible.
2005_claruslow_PURE,CS shall transfer data concurrently.
2005_claruslow_PURE,CS shall be able to request collector environmental data on demand.
2005_claruslow_PURE,CS shall be able to accept environmental data pushed from collectors.
2005_claruslow_PURE,The Clarus system shall employ industry standards to minimize implementation impact to users and providers.
2005_claruslow_PURE,CS shall be able to extract environmental data from an XML message that conforms to the Clarus standard XML message specification.
2005_claruslow_PURE,CS shall be able to extract environmental data from comma separated value messages.
2005_claruslow_PURE,CS that process comma separated value ASCII text shall be able to dynamically parse environmental data that includes a descriptive header row conforming to the Clarus collector standard message specification.
2005_claruslow_PURE,CS that process comma separated value ASCII text shall be able to dynamically parse environmental data described by a stored collector configuration.
2005_claruslow_PURE,CS shall be able to extract environmental data from CMML version 2 messages.
2005_claruslow_PURE,CS shall be able to extract environmental data from netCDF version 3.6 messages.
2005_claruslow_PURE,The Clarus system shall allow access to new surface transportation related observed environmental data.
2005_claruslow_PURE,The DOG shall be able to monitor new environmental data services as they are added.
2005_claruslow_PURE,The Clarus system shall log data transactions.
2005_claruslow_PURE,The DOG shall be able to record its activities.
2005_claruslow_PURE,The Clarus system shall be able to automatically recover from an unexpected shutdown.
2005_claruslow_PURE,The watchdog service shall monitor the overall Clarus system state.
2005_claruslow_PURE,The watchdog service shall be able to restart unresponsive Clarus system services.
2005_claruslow_PURE,The Clarus system shall allow access to new surface transportation related observed environmental data.
2005_claruslow_PURE,The EMC shall be configurable to allow new observation types to be implemented as they become available.
2005_claruslow_PURE,"The Clarus system shall acquire, process, and disseminate environmental metadata."
2005_claruslow_PURE,The EMC shall be able to process environmental metadata.
2005_claruslow_PURE,"The EMC shall be able to uniquely identify each contributor, collector, and station sensor."
2005_claruslow_PURE,"The EMC shall be able to maintain contact info for each contributor, collector, and station sensor."
2005_claruslow_PURE,"The EMC shall be able to maintain backup contact info for each contributor, collector, and station sensor."
2005_claruslow_PURE,"The EMC shall be able to maintain owner names for each contributor, collector, and station sensor."
2005_claruslow_PURE,The EMC shall be able to maintain an equipment list for each station.
2005_claruslow_PURE,The EMC shall be able to maintain pavement types for stations with corresponding instrumentation.
2005_claruslow_PURE,"The EMC shall be able to maintain latitude, longitude, and elevation for stations."
2005_claruslow_PURE,The EMC shall be able to maintain a reference to additional metadata.
2005_claruslow_PURE,The Clarus system shall employ industry standards to minimize implementation impact to users and providers.
2005_claruslow_PURE,The EMC shall store collector metadata that consists of information based on TMDD & MS/ETMCC.
2005_claruslow_PURE,The Clarus system shall disseminate environmental metadata in response to polling.
2005_claruslow_PURE,EMS shall disseminate metadata in response to polling.
2005_claruslow_PURE,The Clarus system shall disseminate data using standard Internet protocols.
2005_claruslow_PURE,EMS shall disseminate metadata using standard Internet protocols.
2005_claruslow_PURE,The Clarus system shall allow access to new surface transportation related observed environmental data.
2005_claruslow_PURE,The Clarus system shall allow new EMS to be implemented that disseminate new observation types to be implemented as they become available.
2005_claruslow_PURE,The Clarus system shall be able to provide sensor equipment metadata in response to a request.
2005_claruslow_PURE,EMS shall be able to provide sensor equipment metadata in response to a request.
2005_claruslow_PURE,The Clarus system shall minimize the time for data dissemination.
2005_claruslow_PURE,EMS shall respond to queries for metadata within five minutes.
2005_claruslow_PURE,The Clarus system shall log data transactions.
2005_claruslow_PURE,EMS shall log metadata transactions.
2005_claruslow_PURE,"The Clarus system shall acquire, process, and disseminate environmental metadata."
2005_claruslow_PURE,The EMS shall accept source queries that consist of a list of Clarus contributors.
2005_claruslow_PURE,The EMS shall accept source queries that consist of a list of Clarus contributors including station identifier.
2005_claruslow_PURE,The EMS shall accept location queries based on a bounding latitude/longitude coordinate pair.
2005_claruslow_PURE,The EMS shall accept location queries based on latitude/longitude location and radius.
2005_claruslow_PURE,The Clarus system shall transfer data as efficiently as possible.
2005_claruslow_PURE,EMS shall transfer data concurrently.
2005_claruslow_PURE,The Clarus system shall employ industry standards to minimize implementation impact to users and providers.
2005_claruslow_PURE,EMS shall be able to distribute metadata in a comma separated value ASCII format.
2005_claruslow_PURE,The Clarus system shall respond to queries for environmental metadata from the available metadata.
2005_claruslow_PURE,EMS responses shall include metadata that meets the requested metadata query filtering specifications.
2005_claruslow_PURE,EMS shall respond to queries returning no results with a message stating that no results matching that query are available.
2005_claruslow_PURE,The Clarus system shall respond to a request for information within five minutes.
2005_claruslow_PURE,The EMS shall respond to a request for metadata within five minutes.
2005_claruslow_PURE,The Clarus system shall provide environmental data quality flags.
2005_claruslow_PURE,The QEDC shall keep the results of each quality test for each observation for the life of the observation.
2005_claruslow_PURE,The Clarus system shall allow access to new surface transportation related observed environmental data.
2005_claruslow_PURE,The QEDC shall be configurable to allow new observation types to be implemented as they become available.
2005_claruslow_PURE,The Clarus system shall maintain a dynamic library of data for at least seven days.
2005_claruslow_PURE,The QEDC shall maintain observations and their associated quality flags for seven days.
2005_claruslow_PURE,The Clarus system baseline data types shall be defined by the NTCIP ESS 1204 standard.
2005_claruslow_PURE,The QEDC observation types shall be defined by NTCIP ESS 1204.
2005_claruslow_PURE,The Clarus system shall allow service providers to select specific desired data sets.
2005_claruslow_PURE,The QEDC shall support queries for its observations.
2005_claruslow_PURE,The Clarus system shall respond to queries for environmental data from the available data.
2005_claruslow_PURE,The QEDC shall support queries against all of its available observation datasets.
2005_claruslow_PURE,The Clarus system shall support 470 million current observations.
2005_claruslow_PURE,The QEDC combined from all available Clarus hosts shall support 470 million current observations.
2005_claruslow_PURE,The Clarus system shall disseminate data in response to a scheduled request.
2005_claruslow_PURE,QEDS shall disseminate data in response to a scheduled environmental data request.
2005_claruslow_PURE,The Clarus system shall disseminate environmental data in response to polling.
2005_claruslow_PURE,QEDS shall disseminate data in response to an immediate environmental data request.
2005_claruslow_PURE,The Clarus system shall disseminate data in response to a change notification request.
2005_claruslow_PURE,QEDS shall disseminate data in response to a change notification request.
2005_claruslow_PURE,The Clarus system shall be able to notify subscribers when data sets become available.
2005_claruslow_PURE,QEDS shall disseminate environmental data to subscribers when datasets fulfilling a subscription query become available.
2005_claruslow_PURE,QEDS shall be able to disseminate environmental data to contributor subscribers when datasets fulfilling a subscription query applying threshold filters become available.
2005_claruslow_PURE,The Clarus system shall disseminate data using standard Internet protocols.
2005_claruslow_PURE,QEDS system shall disseminate environmental data using standard Internet protocols.
2005_claruslow_PURE,"The Clarus system shall collect, quality check, and disseminate environmental data."
2005_claruslow_PURE,QEDS shall disseminate environmental data.
2005_claruslow_PURE,QEDS shall be able to disseminate environmental data in English units.
2005_claruslow_PURE,The Clarus system shall provide notification of data quality conditions to data contributors.
2005_claruslow_PURE,The observation quality flags shall be used to determine data quality condition notifications.
2005_claruslow_PURE,QEDS shall provide quality checking statistics to data contributors.
2005_claruslow_PURE,The Clarus system shall enable quality managers to review which quality checks passed or failed.
2005_claruslow_PURE,QEDS shall enable quality managers to review which quality checks passed or failed.
2005_claruslow_PURE,The Clarus system shall allow access to new surface transportation related observed environmental data.
2005_claruslow_PURE,QEDS shall be able to disseminate new observation types as they become available.
2005_claruslow_PURE,"The Clarus system shall disseminate NWS watches, warnings, and advisories."
2005_claruslow_PURE,"QEDS shall be able to disseminate NWS watches, warnings, and advisories."
2005_claruslow_PURE,The Clarus system shall minimize the time for data dissemination.
2005_claruslow_PURE,QEDS shall respond to environmental data queries within one minute.
2005_claruslow_PURE,The Clarus system shall be able to disseminate data based on spatial queries.
2005_claruslow_PURE,QEDS shall be able to disseminate data based on spatial queries.
2005_claruslow_PURE,The Clarus system shall be able to restrict environmental data publication based on source.
2005_claruslow_PURE,QEDS shall be able to determine if an observation can be disseminated.
2005_claruslow_PURE,The Clarus system shall log data transactions.
2005_claruslow_PURE,QEDS shall log their activities.
2005_claruslow_PURE,The Clarus system baseline data types shall be defined by the NTCIP ESS 1204 standard.
2005_claruslow_PURE,QEDS shall disseminate environmental data types defined by NTCIP 1204.
2005_claruslow_PURE,"The Clarus system data definitions shall be consistent with the ITE TM 1.03 standard, Functional Level Traffic Management Data Dictionary (TMDD)."
2005_claruslow_PURE,QEDS shall disseminate data with descriptions that conform to the TMDD.
2005_claruslow_PURE,"The Clarus system shall acquire, process, and disseminate environmental data."
2005_claruslow_PURE,"The Clarus system shall be able to acquire, process, and disseminate environmental data from across North America."
2005_claruslow_PURE,QEDS shall be able to disseminate environmental data collected from across North America.
2005_claruslow_PURE,The Clarus system shall transfer data as efficiently as possible.
2005_claruslow_PURE,QEDS shall transfer data concurrently.
2005_claruslow_PURE,The Clarus system shall employ industry standards to minimize implementation impact to users and providers.
2005_claruslow_PURE,QEDS shall be able to disseminate environmental data in netCDF version 3.6 format.
2005_claruslow_PURE,QEDS shall be able to disseminate environmental data in HDF version 5 format.
2005_claruslow_PURE,QEDS shall be able to disseminate environmental data in CMML version 2 format.
2005_claruslow_PURE,QEDS shall be able to disseminate environmental data in comma separated value ASCII format.
2005_claruslow_PURE,The Clarus system shall allow service providers to select specific desired datasets.
2005_claruslow_PURE,QEDS shall respond to environmental data queries selecting specific desired datasets.
2005_claruslow_PURE,The Clarus system shall respond to queries for environmental data from the available data.
2005_claruslow_PURE,QEDS shall enable users to request environmental data from among the available output formats.
2005_claruslow_PURE,QEDS shall respond to queries returning no results with a message stating that no results matching that query are available.
2005_claruslow_PURE,The Clarus system shall enable environmental data queries by timestamp.
2005_claruslow_PURE,QEDS shall accept timestamp queries based on a single timestamp range.
2005_claruslow_PURE,The Clarus system shall enable environmental data queries by location reference.
2005_claruslow_PURE,QEDS shall accept location queries based on a bounding latitude/longitude coordinate pair.
